{
  "schema_version": 1,
  "programme_id": "commodity-ng",
  "mission": "Determine whether Commodity can develop a defensible natural-gas forecasting or trading edge.",
  "current_scan_id": "programme-evidence-map-2026-08-29",
  "retrospective_synthesis": {
    "as_of": "2026-08-31",
    "purpose": "Preserve zoom-in/zoom-out programme memory without rewriting historical experiment authority.",
    "historical_fact_rule": "historical_facts are summaries of cited authoritative evidence; programme_interpretation is the current programme-level reading and may change as new evidence arrives.",
    "state_rule": "Keep rejected_by_evidence, open_untested, and interesting_observation distinct; untested is not promising and a narrow rejection is not a global rejection of an information family."
  },
  "refresh_triggers": [
    "major_research_line_exhausted",
    "several_experiments_change_beliefs",
    "important_external_evidence_changes",
    "next_major_branch_selection"
  ],
  "research_lines": [
    {
      "research_line_id": "line-v1-next-session-return-baseline",
      "status": "rejected_by_evidence",
      "big_picture": "Establish an honest leakage-safe baseline before escalating model complexity.",
      "why_zoomed_in": "The programme needed to know whether daily market state, seasonality and PIT exogenous context could beat a simple zero-return control.",
      "tested_role_target_horizon": "Naive/zero, Ridge and HistGB next-session log-return forecasting at a one-session horizon under expanding walk-forward evaluation.",
      "historical_facts": {"observed": "The frozen V1 tournament completed reproducibly and did not establish a robust predictive edge.", "rules_out": "Promotion of the tested V1 hypothesis/model ladder for this target and contract.", "does_not_rule_out": "Different targets, horizons, mechanisms, signal roles or later integrated decisions."},
      "useful_secondary_observations": ["The zero-return baseline is a strong hurdle for later return experiments.", "V1 became the common comparison baseline rather than a promoted model."],
      "remaining_untested_roles": ["mechanism-specific returns", "volatility", "curve/spread change", "non-forecast signal roles"],
      "revisit_trigger": "Only revisit one-session return forecasting when a bounded mechanism or new information source changes the expected-information-value case.",
      "programme_interpretation": "Move from generic model search toward complementary, mechanism-led signal families and stronger controls.",
      "evidence_refs": ["config/experiment.json", "docs/development/v1-research-completion/phase-d-closeout.json"],
      "experiment_history": [{"experiment_id": "ng-next-session-return-baseline-v1", "issue_lineage": [13,15,16,17,18,19,20,21], "result": "no_robust_edge"}]
    },
    {
      "research_line_id": "line-v2-original-components",
      "status": "mixed_closed_and_untested",
      "big_picture": "Ask whether new model and PIT indicator families add information beyond V1 before attempting fusion.",
      "why_zoomed_in": "V1 failed to establish an edge, so V2 decomposed the problem into Kronos and indicator/surprise components with fusion only after valid component evidence.",
      "tested_role_target_horizon": "Kronos-only and indicator-only next-session return components, with fusion/sensitivity contingent on valid predecessors.",
      "historical_facts": {"observed": "The original Kronos result lineage was superseded after contract/target defects; the indicator path failed closed before fit on frozen weather staleness; fusion and sensitivity never produced empirical results.", "rules_out": "Treating the original #82 result or unexecuted #84/#85 designs as evidence of an edge.", "does_not_rule_out": "Corrected same-contract model tests or future bounded uses of the underlying information families."},
      "useful_secondary_observations": ["Fail-closed data gates prevented rescue search after a frozen input violation.", "Fusion must not proceed when component evidence is invalid or absent."],
      "remaining_untested_roles": ["corrected model role", "future PIT indicators under a new justified contract"],
      "revisit_trigger": "A new bounded hypothesis must have valid PIT inputs, same-contract comparators and independent confirmation capacity before execution.",
      "programme_interpretation": "Preserve the negative/untested distinction and repair contract continuity before interpreting model quality.",
      "evidence_refs": ["config/experiment_candidates.json"],
      "experiment_history": [{"issue":82,"result":"superseded_original_lineage"},{"issue":83,"result":"fail_closed_before_fit"},{"issue":84,"result":"not_executed"},{"issue":85,"result":"not_executed"}]
    },
    {
      "research_line_id": "line-corrected-kronos-direct-return",
      "status": "rejected_by_evidence",
      "big_picture": "Retest Kronos only after fixing target and contract continuity so the result is comparable and auditable.",
      "why_zoomed_in": "The original Kronos lineage could not support a trustworthy model conclusion; a corrected frozen three-checkpoint comparison was required.",
      "tested_role_target_horizon": "Kronos Mini/Small/Base as direct one-step next-session return forecasters on 204 common OOS rows.",
      "historical_facts": {"observed": "Mini RMSE 0.0616096, Small 0.0552931 and Base 0.0664801 were all worse than zero-return 0.0453231 and V1 HistGB 0.0465073; checkpoint size did not improve monotonically.", "rules_out": "Direct one-step Kronos promotion for the frozen target/grain and post-result size rescue.", "does_not_rule_out": "Kronos in a materially different bounded role, target, horizon or representation."},
      "useful_secondary_observations": ["Model scale was not a reliable path to improvement.", "Corrected contract identity changed the scientific conclusion from ambiguous to negative."],
      "remaining_untested_roles": ["non-return representation role", "different mechanism-specific target where separately justified"],
      "revisit_trigger": "Only a preregistered role with a distinct mechanism, adequate effective information and fresh confirmation can reopen Kronos research.",
      "programme_interpretation": "Retire direct one-step Kronos and change the research question before changing model size.",
      "evidence_refs": ["artifacts/kronos-confirmation/kronos-180-corrected-three-checkpoint-v1/result.json"],
      "experiment_history": [{"issue":180,"result":"drop_direct_one_step_kronos","rows":204}]
    },
    {
      "research_line_id": "line-target-redesign-volatility-events",
      "status": "interesting_observation_not_confirmed",
      "big_picture": "Test whether changing the economic/statistical target reveals stronger structure than generic next-session returns.",
      "why_zoomed_in": "Repeated return-model failures made target and mechanism selection more valuable than broader model search.",
      "tested_role_target_horizon": "Realized-volatility/variance diagnostics followed by power-gated volatility and event-specific confirmation designs.",
      "historical_facts": {"observed": "The HAR-style volatility diagnostic improved QLIKE by about 15.55% on 204 diagnostic rows, but protected confirmation was not opened because power gates showed detectable effects materially larger than the declared 5% MEPI.", "rules_out": "Claiming a confirmed volatility edge from the diagnostic or spending protected confirmation when the design is underpowered.", "does_not_rule_out": "Volatility or event mechanisms with materially more effective information, stronger effect size, or a different predeclared design."},
      "useful_secondary_observations": ["Volatility persistence is the strongest positive diagnostic observation so far.", "Calendar row count is not equivalent to effective independent information."],
      "remaining_untested_roles": ["adequately powered volatility confirmation", "mechanism-led event returns", "curve/spread change"],
      "revisit_trigger": "Reopen only when nuisance-only feasibility shows detectable effect at or below the declared MEPI while preserving fresh confirmation.",
      "programme_interpretation": "Keep volatility alive as an observation, not a promoted signal; make power and MEPI a precondition for protected testing.",
      "evidence_refs": ["artifacts/volatility-diagnostic/volatility-195-gk-har-v1/summary.json", "config/sealed_windows.json"],
      "experiment_history": [{"issue":195,"result":"diagnostic_signal_only","rows":204},{"issues":[197,201,203,205,207,209],"result":"stopped_by_power_gate_before_protected_confirmation"}]
    },
    {
      "research_line_id": "line-timesfm-return-complementarity",
      "status": "rejected_by_evidence",
      "big_picture": "Test whether a strong external foundation time-series model adds standalone or complementary return information without widening the search adaptively.",
      "why_zoomed_in": "A bounded zero-shot challenger could test model-family complementarity while preserving the same 204-row comparison contract.",
      "tested_role_target_horizon": "TimesFM 2.5 zero-shot next-session return representations and exactly 12 preregistered 50/50 blends with V1 HistGB.",
      "historical_facts": {"observed": "Standalone point forecasts did not beat zero-return; some representations were complementary to HistGB, but all 12 bounded blends failed the stronger zero-return joint gate.", "rules_out": "Promotion of the tested TimesFM return/blend programme and treating the consumed 204 rows as fresh confirmation.", "does_not_rule_out": "A new, distinct TimesFM role with its own bounded hypothesis and untouched confirmation path."},
      "useful_secondary_observations": ["Complementarity against another model is insufficient if the combined system still fails the economic/statistical baseline.", "A bounded successor avoided turning an observation into open-ended blend search."],